{
  "schema_version": "external_security_benchmark_manifest.v1",
  "benchmark": "owasp_crs_path_file_access.v1",
  "source": {
    "benchmark_source": "owasp_crs",
    "revision": "96d9f99043b89f07fb5a4fdad1d7effbbbbcec1a"
  },
  "annotation": {
    "version": "owasp_crs_path_file_access.v1"
  },
  "cases": [
    {
      "case_id": "owasp_crs.930100.1",
      "observability": {
        "eligible": false,
        "status": "partial",
        "surface": "request.headers.FoobarHeader",
        "required_capabilities": [
          "arbitrary_request_headers"
        ],
        "exclusion_reason": "header_not_available",
        "note": "The payload exists only in an arbitrary request header."
      },
      "expected": {
        "project_ground_truth": "not_scored",
        "candidate_expected": null,
        "classification_policy": "not_scored",
        "allowed_stage1_verdicts": [],
        "forbidden_stage1_verdicts": [],
        "mapping_by_verdict": {},
        "boundary": "request_pattern_only"
      },
      "review": {
        "status": "approved",
        "note": "Future header-capability lane; CRS expectation remains source provenance."
      }
    },
    {
      "case_id": "owasp_crs.930100.2",
      "observability": {
        "eligible": true,
        "status": "direct",
        "surface": "request_target.query_value",
        "required_capabilities": [
          "raw_request",
          "raw_request_target",
          "query_string"
        ],
        "exclusion_reason": null,
        "note": "Triple-dot escape is visible in the raw request target."
      },
      "expected": {
        "project_ground_truth": "attack_positive",
        "candidate_expected": true,
        "classification_policy": "exact",
        "allowed_stage1_verdicts": [
          "suspicious_path_traversal"
        ],
        "forbidden_stage1_verdicts": [
          "suspicious_sqli",
          "suspicious_xss",
          "suspicious_file_disclosure"
        ],
        "mapping_by_verdict": {
          "suspicious_path_traversal": {
            "required_ids": [
              "A01:2025",
              "CWE-22",
              "WSTG-ATHZ-01"
            ],
            "forbidden_ids": [
              "CWE-552"
            ]
          }
        },
        "boundary": "attempt_pattern_only_no_file_read_or_exploit_success"
      },
      "review": {
        "status": "approved",
        "note": "Explicit triple-dot directory escape is a strict traversal case."
      }
    },
    {
      "case_id": "owasp_crs.930100.3",
      "observability": {
        "eligible": true,
        "status": "direct",
        "surface": "request_target.query_value",
        "required_capabilities": [
          "raw_request",
          "raw_request_target",
          "query_string"
        ],
        "exclusion_reason": null,
        "note": "Encoded triple-dot payload is preserved verbatim in the raw target."
      },
      "expected": {
        "project_ground_truth": "attack_positive",
        "candidate_expected": true,
        "classification_policy": "exact",
        "allowed_stage1_verdicts": [
          "suspicious_path_traversal"
        ],
        "forbidden_stage1_verdicts": [
          "suspicious_sqli",
          "suspicious_xss",
          "suspicious_file_disclosure"
        ],
        "mapping_by_verdict": {
          "suspicious_path_traversal": {
            "required_ids": [
              "A01:2025",
              "CWE-22",
              "WSTG-ATHZ-01"
            ],
            "forbidden_ids": [
              "CWE-552"
            ]
          }
        },
        "boundary": "attempt_pattern_only_no_file_read_or_exploit_success"
      },
      "review": {
        "status": "approved",
        "note": "Strict traversal semantics; current decoder coverage is evaluated later, not emulated here."
      }
    },
    {
      "case_id": "owasp_crs.930100.4",
      "observability": {
        "eligible": false,
        "status": "partial",
        "surface": "request.headers.FoobarHeader",
        "required_capabilities": [
          "arbitrary_request_headers"
        ],
        "exclusion_reason": "header_not_available",
        "note": "The payload exists only in an arbitrary request header."
      },
      "expected": {
        "project_ground_truth": "not_scored",
        "candidate_expected": null,
        "classification_policy": "not_scored",
        "allowed_stage1_verdicts": [],
        "forbidden_stage1_verdicts": [],
        "mapping_by_verdict": {},
        "boundary": "request_pattern_only"
      },
      "review": {
        "status": "approved",
        "note": "Future header-capability lane; request target itself contains no traversal payload."
      }
    },
    {
      "case_id": "owasp_crs.930100.5",
      "observability": {
        "eligible": false,
        "status": "out_of_scope",
        "surface": "request.body.xml_attribute",
        "required_capabilities": [
          "request_body",
          "xml_body"
        ],
        "exclusion_reason": "xml_body_not_logged",
        "note": "The encoded payload exists only in an XML body attribute."
      },
      "expected": {
        "project_ground_truth": "not_scored",
        "candidate_expected": null,
        "classification_policy": "not_scored",
        "allowed_stage1_verdicts": [],
        "forbidden_stage1_verdicts": [],
        "mapping_by_verdict": {},
        "boundary": "request_pattern_only"
      },
      "review": {
        "status": "approved",
        "note": "Canonical Apache logs do not preserve XML request bodies."
      }
    },
    {
      "case_id": "owasp_crs.930110.1",
      "observability": {
        "eligible": false,
        "status": "partial",
        "surface": "request.headers.FoobarHeader",
        "required_capabilities": [
          "arbitrary_request_headers"
        ],
        "exclusion_reason": "header_not_available",
        "note": "The traversal payload exists only in an arbitrary request header."
      },
      "expected": {
        "project_ground_truth": "not_scored",
        "candidate_expected": null,
        "classification_policy": "not_scored",
        "allowed_stage1_verdicts": [],
        "forbidden_stage1_verdicts": [],
        "mapping_by_verdict": {},
        "boundary": "request_pattern_only"
      },
      "review": {
        "status": "approved",
        "note": "Future header-capability lane."
      }
    },
    {
      "case_id": "owasp_crs.930110.2",
      "observability": {
        "eligible": true,
        "status": "direct",
        "surface": "request_target.query_value",
        "required_capabilities": [
          "raw_request",
          "raw_request_target",
          "query_string"
        ],
        "exclusion_reason": null,
        "note": "Directory escape and target file are visible in the query value."
      },
      "expected": {
        "project_ground_truth": "attack_positive",
        "candidate_expected": true,
        "classification_policy": "exact",
        "allowed_stage1_verdicts": [
          "suspicious_path_traversal"
        ],
        "forbidden_stage1_verdicts": [
          "suspicious_sqli",
          "suspicious_xss",
          "suspicious_file_disclosure"
        ],
        "mapping_by_verdict": {
          "suspicious_path_traversal": {
            "required_ids": [
              "A01:2025",
              "CWE-22",
              "WSTG-ATHZ-01"
            ],
            "forbidden_ids": [
              "CWE-552"
            ]
          }
        },
        "boundary": "attempt_pattern_only_no_file_read_or_exploit_success"
      },
      "review": {
        "status": "approved",
        "note": "Strong strict traversal positive; source expect_ids is not the project label."
      }
    },
    {
      "case_id": "owasp_crs.930110.3",
      "observability": {
        "eligible": false,
        "status": "out_of_scope",
        "surface": "request.body.form",
        "required_capabilities": [
          "request_body",
          "form_body"
        ],
        "exclusion_reason": "post_body_not_logged",
        "note": "The traversal payload exists only in URL-encoded POST data."
      },
      "expected": {
        "project_ground_truth": "not_scored",
        "candidate_expected": null,
        "classification_policy": "not_scored",
        "allowed_stage1_verdicts": [],
        "forbidden_stage1_verdicts": [],
        "mapping_by_verdict": {},
        "boundary": "request_pattern_only"
      },
      "review": {
        "status": "approved",
        "note": "Canonical Apache logs do not preserve POST form bodies."
      }
    },
    {
      "case_id": "owasp_crs.930110.4",
      "observability": {
        "eligible": true,
        "status": "direct",
        "surface": "request_target.path",
        "required_capabilities": [
          "raw_request",
          "raw_request_target"
        ],
        "exclusion_reason": null,
        "note": "Embedded foo../ is not a segment-boundary directory escape."
      },
      "expected": {
        "project_ground_truth": "project_negative",
        "candidate_expected": false,
        "classification_policy": "forbidden_only",
        "allowed_stage1_verdicts": [
          "benign_normal",
          "likely_false_positive",
          "inconclusive"
        ],
        "forbidden_stage1_verdicts": [
          "suspicious_path_traversal"
        ],
        "mapping_by_verdict": {},
        "boundary": "request_pattern_only"
      },
      "review": {
        "status": "approved",
        "note": "Embedded foo../ is not a segment-boundary directory escape."
      }
    },
    {
      "case_id": "owasp_crs.930110.5",
      "observability": {
        "eligible": true,
        "status": "direct",
        "surface": "request_target.path",
        "required_capabilities": [
          "raw_request",
          "raw_request_target"
        ],
        "exclusion_reason": null,
        "note": "Embedded foo.../ is not a segment-boundary directory escape."